source,text,url
youtube,"how Spotify founder convinced music labels to join forces, it's a great lesson. solve a difficult problem because we are not we are we are more interested in content than being successful. No, so stories are more interesting. >> Why do you think it's like that? >> Because successful entertainment. >> Yeah. Because how are we respected in our community by being more interesting sometimes? Going back to the >> Yeah. We often call successful and somebody who comes and say, ""Oh, I went on a date or I often wonder by the way sometimes that who are in perpetual new relationships often are trying to be interesting sometimes cuz it's new content for their friends."" You've also said somewhere uh most Indians settle for average careers. >> H >> why why do you believe so? And why do you think Indians >> I I don't think I've said that we settle for average careers. I think we we settle for settling. I think what I mean by that is that right and it was a right decision at some point of time because we were very poor as a country and uh stability uh like we used to seek government jobs we still do because it provided stability right so it made sense to chase settlement settling >> but as you look at the next generation ation they are not choosing for settling because their family is settled they're not worried about >> will I have a place to stay so when when basics are taken care of we become slightly more ambitious so you feel now it's changed do you think that's also there's a flip side to it a lot of entrepreneurs complain about it on the podcast also they've complained that >> lot of young people because they don't care about settling They are so flirtatious with their careers. They're not building their depth in any one field. Yeah. See the thing is um if you are not worried about how you will be taken care of long term, >> it's okay to be short-term about things, right? You you are trying to jump between different things or whatever. So for example, younger generation is lot more driven by short-term approach to life cuz they have not seen anything long-term, right? Uh we've seen the average length of relationships also to come down, right? Like >> I often hear people saying that oh I was in this relationship for 8 months and and somebody who came from my generation or one before that >> it would sound absurd till somebody says that. >> So I think everybody's timeline has changed, right? Mhm. >> Uh and that is causing this thing of like what we feel of time right K 8 months. So I think that is changing uh and but career if you're not driven by oh my god I'm going to become useless and I'm going to have no money and no family to take care of actually all these people who are flirtatious with their career if their parents threw them out of the house or told them you have access to any of the money that they have made or their parents were short-term and without all their money, you would automatically become more long-term. >> 100% 100%. >> So they're they be afford they're able to afford being short-term because >> because some other people around them are being long-term. >> Do you think that [Music] that's what very common thing used to happen in the west? No. Westme getting people kids out at the age of 18 was exactly built for that reason right not just getting rid of them they were not just thrown out they were chopped off from all financially help should we do that should we kick our kids out >> I don't know what we want from life no who who decides right wrong I I don't know if you want them to become extraordinary successful yes you have to make them starve when I use the word starve is metaphorical is be deprived of support and resources. >> Yeah. Safety nets do not create always good athletes, right? Like >> uh the the the fear of almost dying is what makes you really come alive. >> Yeah. You use the word extraordinary. >> You want them to become extraordinary then make them starve. How to become extraordinary? If somebody who's watching this wants to become an extraordinary person, >> first of all, you shouldn't have time to watch this podcast. But I think the the the point around any big achievement comes from overcoming many many obstacles. Overcoming many many obstacles is when you are putting yourself out there and when you are giving it",https://www.youtube.com/watch?v=YIszsqhLGIs
youtube,"I often hear people saying that oh I was in this relationship for 8 months and and somebody who came from my generation or one before that >> it would sound absurd till somebody says that. >> So I think everybody's timeline has changed, right? Mhm. >> Uh and that is causing this thing of like what we feel of time right K 8 months. So I think that is changing uh and but career if you're not driven by oh my god I'm going to become useless and I'm going to have no money and no family to take care of actually all these people who are flirtatious with their career if their parents threw them out of the house or told them you have access to any of the money that they have made or their parents were short-term and without all their money, you would automatically become more long-term. >> 100% 100%. >> So they're they be afford they're able to afford being short-term because >> because some other people around them are being long-term. >> Do you think that [Music] that's what very common thing used to happen in the west? No. Westme getting people kids out at the age of 18 was exactly built for that reason right not just getting rid of them they were not just thrown out they were chopped off from all financially help should we do that should we kick our kids out >> I don't know what we want from life no who who decides right wrong I I don't know if you want them to become extraordinary successful yes you have to make them starve when I use the word starve is metaphorical is be deprived of support and resources. >> Yeah. Safety nets do not create always good athletes, right? Like >> uh the the the fear of almost dying is what makes you really come alive. >> Yeah. You use the word extraordinary. >> You want them to become extraordinary then make them starve. How to become extraordinary? If somebody who's watching this wants to become an extraordinary person, >> first of all, you shouldn't have time to watch this podcast. But I think the the the point around any big achievement comes from overcoming many many obstacles. Overcoming many many obstacles is when you are putting yourself out there and when you are giving it hours attention thing. For example, anybody who's built a great physique has not got it accidentally. >> Yeah. >> They were given extraordinary amount of attention, thinking, obsession, focus on food, workout, sleep, like it's their being which got gets them to that particular thing. Anybody who's got to any version of success as an entrepreneur, same anybody who's achieved any version of these things and they they are putting themselves out there and getting out of comfort zone, right? See, comfort zone is a very infertile land. Okay? But it keeps you safe. So if you want to be extraordinary just kill >> extraordinary anything like I'm not saying that you have to wealth is not the only metric I I don't know >> extraordinary I mean anything yeah anything >> but do you think that that means it'll require for you to just kill your comfort >> yeah it's impossible to be extraordinary in comfort zone >> what's the truth about discipline and ambition because a lot of people want to They think they're ambitious. They say that they're ambitious. I don't know if their actions match that or no. >> Mostly they don't. >> Uh >> so what do people misunderstand about? >> It's cool to say you're ambitious. No. Most ambitious people will never say they're ambitious. They are just doing stuff, building stuff. They are just out there. They don't write all these tag words on their Twitter or Instagram or LinkedIn. They're just doing stuff. The need to put so many labels to who we are. >> But when you ask them, they say they're ambitious. >> No. Will will they identify as an ambitious person? Yes. They're not trying to tell the world they're ambitious. >> Like fill their Instagram bio and LinkedIn bio with all these fancy keywords. What do you think people misunderstand about ambition and discipline? >> No, I think it's uh it's uh being it's what you are. It's like it's not a thing that you can a weak Do you think it's a trait or a skill or something that people can build? Like can they turn themselves into an ambitious person or no? I I think though drives are very hard to get externally. You can't get in drive from external purpose. But I do feel that if you are around ambitious people and they are a",https://www.youtube.com/watch?v=YIszsqhLGIs
youtube,"hours attention thing. For example, anybody who's built a great physique has not got it accidentally. >> Yeah. >> They were given extraordinary amount of attention, thinking, obsession, focus on food, workout, sleep, like it's their being which got gets them to that particular thing. Anybody who's got to any version of success as an entrepreneur, same anybody who's achieved any version of these things and they they are putting themselves out there and getting out of comfort zone, right? See, comfort zone is a very infertile land. Okay? But it keeps you safe. So if you want to be extraordinary just kill >> extraordinary anything like I'm not saying that you have to wealth is not the only metric I I don't know >> extraordinary I mean anything yeah anything >> but do you think that that means it'll require for you to just kill your comfort >> yeah it's impossible to be extraordinary in comfort zone >> what's the truth about discipline and ambition because a lot of people want to They think they're ambitious. They say that they're ambitious. I don't know if their actions match that or no. >> Mostly they don't. >> Uh >> so what do people misunderstand about? >> It's cool to say you're ambitious. No. Most ambitious people will never say they're ambitious. They are just doing stuff, building stuff. They are just out there. They don't write all these tag words on their Twitter or Instagram or LinkedIn. They're just doing stuff. The need to put so many labels to who we are. >> But when you ask them, they say they're ambitious. >> No. Will will they identify as an ambitious person? Yes. They're not trying to tell the world they're ambitious. >> Like fill their Instagram bio and LinkedIn bio with all these fancy keywords. What do you think people misunderstand about ambition and discipline? >> No, I think it's uh it's uh being it's what you are. It's like it's not a thing that you can a weak Do you think it's a trait or a skill or something that people can build? Like can they turn themselves into an ambitious person or no? I I think though drives are very hard to get externally. You can't get in drive from external purpose. But I do feel that if you are around ambitious people and they are a they feel the need to keep you around. M >> you'll become more ambitious. Let me put it this way. I think you can make somebody more ambitious. >> Okay. >> I don't think you going to make somebody ambitious. H >> So you're saying people are born ambitious or maybe something has happened to them over the years. >> A lot of people become ambitious later on in life when they can completely bankrupt at >> 30. Then they get something and they or they have some major relationship issues and that makes them so some life event causes them to see people maintain their slope. >> Yeah. True. You also say that Indians are high on aspiration but low on trust. Why do you say so? I don't think I've I've said it the way you're saying it, but uh I think every human is aspirational >> because nobody's happy with what they have. Actually, happiness comes from absolutely wanting what you have. Okay. Uh and progress comes from absolutely wanting what you don't have. >> Yeah. >> Okay. Uh but yeah uh when you think about trust, trust is a very complex thing, right? Trust comes from like if you think about trust, it's a more of a game theory problem where you could argue that it should benefit everybody to show good trustworthy behavior and then society becomes more trustworthy. Right? For example, um if the cost of being not trustworthy was very high >> in a country, then lot of people would be trustworthy, right? Uh for example, if the cost of breaking rules is dramatically going to cost you, we behave well. >> Yeah. >> Uh think about the teachers we had in school where we could escape not doing a homework or not doing an assignment or where you could not. You saw the compliance >> to be very different. >> Very very different. So often good trustworthy behavior comes from that. Let me give an example. Let's say a lot of people are not able to pay back their loans and there are two broad reasons. They do not have the ability. They have lost a job. They have done thing and some people do not have the intent. But what if we did something like that that all the people who have willfully defaulted we tell them you cannot take digatra",https://www.youtube.com/watch?v=YIszsqhLGIs
youtube,"they feel the need to keep you around. M >> you'll become more ambitious. Let me put it this way. I think you can make somebody more ambitious. >> Okay. >> I don't think you going to make somebody ambitious. H >> So you're saying people are born ambitious or maybe something has happened to them over the years. >> A lot of people become ambitious later on in life when they can completely bankrupt at >> 30. Then they get something and they or they have some major relationship issues and that makes them so some life event causes them to see people maintain their slope. >> Yeah. True. You also say that Indians are high on aspiration but low on trust. Why do you say so? I don't think I've I've said it the way you're saying it, but uh I think every human is aspirational >> because nobody's happy with what they have. Actually, happiness comes from absolutely wanting what you have. Okay. Uh and progress comes from absolutely wanting what you don't have. >> Yeah. >> Okay. Uh but yeah uh when you think about trust, trust is a very complex thing, right? Trust comes from like if you think about trust, it's a more of a game theory problem where you could argue that it should benefit everybody to show good trustworthy behavior and then society becomes more trustworthy. Right? For example, um if the cost of being not trustworthy was very high >> in a country, then lot of people would be trustworthy, right? Uh for example, if the cost of breaking rules is dramatically going to cost you, we behave well. >> Yeah. >> Uh think about the teachers we had in school where we could escape not doing a homework or not doing an assignment or where you could not. You saw the compliance >> to be very different. >> Very very different. So often good trustworthy behavior comes from that. Let me give an example. Let's say a lot of people are not able to pay back their loans and there are two broad reasons. They do not have the ability. They have lost a job. They have done thing and some people do not have the intent. But what if we did something like that that all the people who have willfully defaulted we tell them you cannot take digatra you cannot do tatkal tickets. Now imagine five friends are going to the airport and four people go to datra and you're like oh no I'll go from here. >> Social embarrassment. What if landlords do not rent a property to somebody who has willfully defaulted on their credit scores. >> Mhm. >> Which happens by the way in most developed world. Credit scores are checked for before renting an apartment. What if people would not get married without checking credit scores? >> That's a good framework to put. >> And why wouldn't you want to check? What if it became normal? >> But why is it important for a country to start trusting a lot to build a country? >> It cannot be prosperous without trusting. See when country cannot be trusting then we all the transactions require too much of checking again and again. For example let's say if no builder could cause a damage to a buyer otherwise they would have severe punishments. M to buying property and land would become a trustworthy transaction versus there is so much friction 90% so economic prosperity but what if you knew and why do you think it's it takes every every country goes through and change and trust. For example, let's say uh look at the success of UPI, >> right? Only when it can consistently be reliable and prevent frauds and do everything, it'll be adopted by now close to 500 million Indians use it. >> Why do you think we trust digital apps but not human beings as much? >> No, I think your app I don't think that's the case. I think we trust that can be verified to be consistent. So trust comes from four things. I often say this but I'll repeat it. Trust comes from the presence of four things. But it's not you need to be having all four in place. If visibly any of the four things are absent, you cannot trust something or someone. First is integrity. And integrity is not a integity integrity institution integrity. >> Second consistency consistency. You can predict them >> like a clockwork. >> Yeah. >> Uh uh uh third is like competence. Do they know? Right. Imagine you are trying to go for a uh paragliding and this guy's like uh sir you are my first client right you would not be interested in",https://www.youtube.com/watch?v=YIszsqhLGIs
youtube,"you cannot do tatkal tickets. Now imagine five friends are going to the airport and four people go to datra and you're like oh no I'll go from here. >> Social embarrassment. What if landlords do not rent a property to somebody who has willfully defaulted on their credit scores. >> Mhm. >> Which happens by the way in most developed world. Credit scores are checked for before renting an apartment. What if people would not get married without checking credit scores? >> That's a good framework to put. >> And why wouldn't you want to check? What if it became normal? >> But why is it important for a country to start trusting a lot to build a country? >> It cannot be prosperous without trusting. See when country cannot be trusting then we all the transactions require too much of checking again and again. For example let's say if no builder could cause a damage to a buyer otherwise they would have severe punishments. M to buying property and land would become a trustworthy transaction versus there is so much friction 90% so economic prosperity but what if you knew and why do you think it's it takes every every country goes through and change and trust. For example, let's say uh look at the success of UPI, >> right? Only when it can consistently be reliable and prevent frauds and do everything, it'll be adopted by now close to 500 million Indians use it. >> Why do you think we trust digital apps but not human beings as much? >> No, I think your app I don't think that's the case. I think we trust that can be verified to be consistent. So trust comes from four things. I often say this but I'll repeat it. Trust comes from the presence of four things. But it's not you need to be having all four in place. If visibly any of the four things are absent, you cannot trust something or someone. First is integrity. And integrity is not a integity integrity institution integrity. >> Second consistency consistency. You can predict them >> like a clockwork. >> Yeah. >> Uh uh uh third is like competence. Do they know? Right. Imagine you are trying to go for a uh paragliding and this guy's like uh sir you are my first client right you would not be interested in that. Uh and fourth is benevalence or non-self-centered behavior. If you knew that somebody is only self-centered you're like less likely to trust them. So it's not all four are needed but absence let's say the paragliding person example uh the person has integrity consistency self-centered competence question right now let's say you are investing with somebody you see competence you see uh consistency in their performance uh uh you see they are bare but they are like integrity is >> sort of shady >> shady so trust doesn't come that way so only when these four things are consistently done trust comes naturally okay let me give you an example just a thought experiment when you look at countries like us people who are who have built one sort of organization and they're known for certain thing they less likely to be trusted in something else. So for example, if Apple who's making phones, people trust them because they they've shown consistency and competence in phones. It's less likely for them to start selling salt. People will question them. >> Not really. They would not question. In fact, if you look at the history of US, they're exactly built that way. >> One company needs to do everything, >> right? >> Today, do you think they do that? No, they don't need to because the markets are deep enough for them to not focus to to be focused. >> So you think the conglomerate thing but okay >> so trust see concentration of trust happens in low trust societies. >> In India it happens. >> So because you will trust like 20% 20 people 30 people contribute to 90% of all Bollywood revenue or entertainment revenue. >> Uh and then you will see uh super apps happen in low trust countries. doesn't happen in high trust countries. You do not see large conglomerates emerge in low trust countries or whatever. But if you go back in past, US also has all of these three things in the past because as a society found trust in the institutions, right? For example, if you have a bad fall at a cafe, doesn't matter what the cafe brand is, the government will protect you >> versus you thinking about your own protection because the institutions are very built for large scale. Automatically trust comes in everything, right? So what happens is for",https://www.youtube.com/watch?v=YIszsqhLGIs
