source,text,url
youtube,"to work on. >> It's a good indicator. It's like engine light. So something bother is a good place. >> Yeah. >> I don't ignore it usually. uh and try to understand also why it bothers me. sometimes discover it's not worth bothering about >> I do this I I write notes on like let's say weekly or 20 days make whenever I get angry or bothered I write down I get bothered or angry and then whenever I have time >> you should write down why did I get bothered >> so that's what and then whenever I have time at the end of the weekend or somewhere or I'm in a long flight I open those notes and be like okay is time I got angry why did I get angry where is this coming If you if you go more into why >> emotions will disappear. >> The word why is a very powerful thing to go into logic versus emotions. >> So I would say if more people used why they would be less emotional. You said something about India on this point. What was that? >> On again you tweeted that it's hard to imagine for rationality to be at forefront in a society where emotions are celebrated and lack of it is resented. >> Yeah. So for example, robot or somebody who's controlling their emotions. >> So we can't expect rationality to be at forefront over there. >> Is that one of the reasons which is holding us to be very prosperous? >> I don't think so. Prosperity is a very complex topic. Right? For example, I would say uh one gender is working and second gender is not contributing to workforce. No country has become rich by one gender working. It's a much bigger factor than emotions and non-emotions. Right? So complex topic but rationality and curiosity, reason, productivity is important. For example, you will never see country getting prosperous without them really valuing time. You will not see a one country that will become prosperous without valuing time. You will never see country prosperous. You talk about it a lot. No, but it's evidence. It's evidence, right? So uh uh if I found a country that became prosperous by being dumb chill I'm very interested in that and I'm not even saying that we should chase that metric I don't know if it's the right metric to chase okay we should become rich I don't know >> who who knows is the right metric for example we say oh we should try to make people healthy and make them live longer but what if they are not wanting to live who decides that metric right in the past people used to live a good life, die at a good age. Now we keep extending the age by doing medical interventions. Is that a good thing? I don't know. So I I what what I don't like to do is build these firm views. I'm just saying if you want prosperity, >> if you want six pack, should we want six pack? I don't know. >> Should we want prosperity? I don't know. Should we want success? I don't know. Mhm. >> What I know, if you want this, you have to do this. >> But when you ask people, they all say they all want everything. >> Yeah. But they they don't want to do anything about it. >> That's the change we have to do. >> And it's okay to not want some of these things. I know many people who are like very clear >> which is great. Which is great. Problem is when the ambition that comes out of M doesn't say an example, right? We get super offended when somebody talks about working more hours. Huh? Why? Yeah. >> Why get offended by somebody telling you to work harder? >> Why do you think people get offended when they talk about? >> Because when people get offended is usually coming from a place where they know there's some truth to it. Offense doesn't come when there is absence of truth. For example, uh if we remark through somebody that this don't even feel is 1% true, we're less likely to get a reaction out of that. If the person is saying that the country is not going to get prosperous. For example, let's talk about work from home for us. I mean the the whole work life balance situation right now, >> right? days first. So then are we being selective? >> I am very happy if you take the western things and we take all of it then selectively 5 days a week but we'll not say True. People don't go to some distant relative's wedding. >>",https://www.youtube.com/watch?v=YIszsqhLGIs
youtube,"it's the right metric to chase okay we should become rich I don't know >> who who knows is the right metric for example we say oh we should try to make people healthy and make them live longer but what if they are not wanting to live who decides that metric right in the past people used to live a good life, die at a good age. Now we keep extending the age by doing medical interventions. Is that a good thing? I don't know. So I I what what I don't like to do is build these firm views. I'm just saying if you want prosperity, >> if you want six pack, should we want six pack? I don't know. >> Should we want prosperity? I don't know. Should we want success? I don't know. Mhm. >> What I know, if you want this, you have to do this. >> But when you ask people, they all say they all want everything. >> Yeah. But they they don't want to do anything about it. >> That's the change we have to do. >> And it's okay to not want some of these things. I know many people who are like very clear >> which is great. Which is great. Problem is when the ambition that comes out of M doesn't say an example, right? We get super offended when somebody talks about working more hours. Huh? Why? Yeah. >> Why get offended by somebody telling you to work harder? >> Why do you think people get offended when they talk about? >> Because when people get offended is usually coming from a place where they know there's some truth to it. Offense doesn't come when there is absence of truth. For example, uh if we remark through somebody that this don't even feel is 1% true, we're less likely to get a reaction out of that. If the person is saying that the country is not going to get prosperous. For example, let's talk about work from home for us. I mean the the whole work life balance situation right now, >> right? days first. So then are we being selective? >> I am very happy if you take the western things and we take all of it then selectively 5 days a week but we'll not say True. People don't go to some distant relative's wedding. >> People don't take 15 days break for their brother or sister's wedding. So we we tend to get confused >> through selective data. And then there's some truth to it. So we get offended. >> Yeah. For example, if you ask most Indians, are we the best culture in the world? Most people will say yes. If you ask them, how many other cultures have you visited and studied? Indian culture is not great. That's why truth seeeking removes the fence. Do you think in general are we becoming more offensive? >> We becoming sensitive because we have this concept. I I've said this multiple times that when you build reputation before substance, you will get offended very fast, right? And younger people have that unique problem that they are designed to get offended because of their their world that they create around them. >> This 2,000 people like liking world. >> Yeah. And but if you say you said one of the best things which I think you've said it to me was most of the young people are worried about the reputation they don't have. >> Mhm. >> Beautiful. Like so true. >> Mhm. >> Why did you say that? And what do you think? What did you observe? No, because the same thing. you know, they are like worried about how they look, what their image is, their brand, their all of that stuff. And and I'm like, nobody cares about these things eventually. And like you're worried about these things. And I think that repetition prevents them from learning more things because they're worried about their image too much. All right? For example, I see them I see the generation seeking the least amount of help from people because it's I'll look small if I ask help. So the growth is stopped. They're finding it much more comfortable to ask charg. But some help is better to be asked by a person. >> Yeah. >> But you don't see them them seeking help. >> Oh, I have to be like maintain my aura. So they are sure failure in private because they don't want to be seen. >> Yeah. Asking for help. Mhm. >> Why is this happening? Because social media people you're not in touch with they don't know you. >> They know your image about you. They have a brand perception about you. They",https://www.youtube.com/watch?v=YIszsqhLGIs
youtube,"People don't take 15 days break for their brother or sister's wedding. So we we tend to get confused >> through selective data. And then there's some truth to it. So we get offended. >> Yeah. For example, if you ask most Indians, are we the best culture in the world? Most people will say yes. If you ask them, how many other cultures have you visited and studied? Indian culture is not great. That's why truth seeeking removes the fence. Do you think in general are we becoming more offensive? >> We becoming sensitive because we have this concept. I I've said this multiple times that when you build reputation before substance, you will get offended very fast, right? And younger people have that unique problem that they are designed to get offended because of their their world that they create around them. >> This 2,000 people like liking world. >> Yeah. And but if you say you said one of the best things which I think you've said it to me was most of the young people are worried about the reputation they don't have. >> Mhm. >> Beautiful. Like so true. >> Mhm. >> Why did you say that? And what do you think? What did you observe? No, because the same thing. you know, they are like worried about how they look, what their image is, their brand, their all of that stuff. And and I'm like, nobody cares about these things eventually. And like you're worried about these things. And I think that repetition prevents them from learning more things because they're worried about their image too much. All right? For example, I see them I see the generation seeking the least amount of help from people because it's I'll look small if I ask help. So the growth is stopped. They're finding it much more comfortable to ask charg. But some help is better to be asked by a person. >> Yeah. >> But you don't see them them seeking help. >> Oh, I have to be like maintain my aura. So they are sure failure in private because they don't want to be seen. >> Yeah. Asking for help. Mhm. >> Why is this happening? Because social media people you're not in touch with they don't know you. >> They know your image about you. They have a brand perception about you. They don't know you. >> Yeah. >> So I want to maintain that image was the thing. >> Yeah. But but that's what I'm saying. Those are the exact people who find it hard to ask for help. What I'm saying is that it's so much more now. [Music] >> How do we break out of this repetition? Let's say for you'll rarely see success in people who have stopped caring about shame. Shameless important ingredient. >> I believe >> you reached out for the podcast for the first time to me. You didn't care. you were just shameless enough to ping. >> Yeah. >> I said yes. I didn't know whatever. For example, I remember like I discovered so much later Instagram. I didn't care about all these things. Like I was like, okay, sure, do it. Like >> uh uh and what I discovered is that people who reached out were shameless, got the benefit of that. Now I'll be more selective about who reaches out and who I'll say yes to or not say yes to. But earlier you were shameless enough to reach out. You got that. You said I got the highest views for you initially and that was great. What if you had not reached out thinking that yeah what if he says no? I'm sure people have said no to you in the beginning. How many people said no to you in the beginning? >> First 200 guest nobody came. 200 first random. >> Perfect. So, but most people don't get to 200 and and shamelessness. Shame. >> See, that's what I'm saying. For most people, there's a huge shame. Rejection is a huge shame. Being left on red is huge shame for people. Why do people talk about it? Red zone. Don't double text. You ask any young person, double texting is almost a sin for them. But don't maybe >> you'll be surprised. Ask the younger team members. >> Scene zone, right? Like the >> scene zone, red zone, double texting. Ask the younger people in your team. H like will you double text? >> Yeah. Or how do you perceive somebody who double text? >> How do they perceive if you asked? >> You should check like desperate. >> Yeah, it's it's a real >> Who makes these rules though? >> Insecurities. Human insecurities. All rules. All of these come from",https://www.youtube.com/watch?v=YIszsqhLGIs
youtube,"don't know you. >> Yeah. >> So I want to maintain that image was the thing. >> Yeah. But but that's what I'm saying. Those are the exact people who find it hard to ask for help. What I'm saying is that it's so much more now. [Music] >> How do we break out of this repetition? Let's say for you'll rarely see success in people who have stopped caring about shame. Shameless important ingredient. >> I believe >> you reached out for the podcast for the first time to me. You didn't care. you were just shameless enough to ping. >> Yeah. >> I said yes. I didn't know whatever. For example, I remember like I discovered so much later Instagram. I didn't care about all these things. Like I was like, okay, sure, do it. Like >> uh uh and what I discovered is that people who reached out were shameless, got the benefit of that. Now I'll be more selective about who reaches out and who I'll say yes to or not say yes to. But earlier you were shameless enough to reach out. You got that. You said I got the highest views for you initially and that was great. What if you had not reached out thinking that yeah what if he says no? I'm sure people have said no to you in the beginning. How many people said no to you in the beginning? >> First 200 guest nobody came. 200 first random. >> Perfect. So, but most people don't get to 200 and and shamelessness. Shame. >> See, that's what I'm saying. For most people, there's a huge shame. Rejection is a huge shame. Being left on red is huge shame for people. Why do people talk about it? Red zone. Don't double text. You ask any young person, double texting is almost a sin for them. But don't maybe >> you'll be surprised. Ask the younger team members. >> Scene zone, right? Like the >> scene zone, red zone, double texting. Ask the younger people in your team. H like will you double text? >> Yeah. Or how do you perceive somebody who double text? >> How do they perceive if you asked? >> You should check like desperate. >> Yeah, it's it's a real >> Who makes these rules though? >> Insecurities. Human insecurities. All rules. All of these come from human insecurities. >> See, I believe you need to be shameless. That is so true. Everybody needs to be shameless in order to win. But what% of people threshold is >> No, shameless is a binary term. >> Like what we're talking about is I would never even think that this is shameful. Reaching out to somebody on an email and or Instagram. >> Not for everyone. Not for everyone. Okay. I'm going to do a thought experiment with you. A lot of team members are outside. experiment. Um, all of them have to act like a a beggar on the street and whoever gets 100 rupees wins a big prize. How many people will agree to this experiment? Number two, how many people will be able to pull this off? Number three, how would they think about themselves? Some people you know shameless you know you can already identify which four five people will just go and get the 100 rupees also >> exactly >> like I know you would go I would go like very like zero there's nothing in it it's just >> exactly but it's not >> good story to tell [ __ ] >> yeah I've done it once in college as a as a bet >> yeah so shame is directly It's preventing success for sure. >> True. And if you won't Yeah. Actually, if you won't be shameless, you won't get the opportunity that you want. You won't get the girl that you want. You won't get anything. Anything >> any level of success that you're actually looking out for? >> Anything. >> What's the level of shame which is accepted or not? Is there some shame? >> There's no such thing >> because there has to be some thin line, right? like not be >> see means saying oh you become creepy is a very different thing. >> Yeah. Would you be offended if somebody reaches out to you 20 times? >> No absolutely not. Why would I be offended by that? >> Like you're just like what the [ __ ] Like you'll block that person like irritate you because you didn't reply once or you didn't reply twice. >> But most people have no craft in reaching out to you, right? They don't establish the value that they provide to you. They send the same text. Like for example, a",https://www.youtube.com/watch?v=YIszsqhLGIs
youtube,"human insecurities. >> See, I believe you need to be shameless. That is so true. Everybody needs to be shameless in order to win. But what% of people threshold is >> No, shameless is a binary term. >> Like what we're talking about is I would never even think that this is shameful. Reaching out to somebody on an email and or Instagram. >> Not for everyone. Not for everyone. Okay. I'm going to do a thought experiment with you. A lot of team members are outside. experiment. Um, all of them have to act like a a beggar on the street and whoever gets 100 rupees wins a big prize. How many people will agree to this experiment? Number two, how many people will be able to pull this off? Number three, how would they think about themselves? Some people you know shameless you know you can already identify which four five people will just go and get the 100 rupees also >> exactly >> like I know you would go I would go like very like zero there's nothing in it it's just >> exactly but it's not >> good story to tell [ __ ] >> yeah I've done it once in college as a as a bet >> yeah so shame is directly It's preventing success for sure. >> True. And if you won't Yeah. Actually, if you won't be shameless, you won't get the opportunity that you want. You won't get the girl that you want. You won't get anything. Anything >> any level of success that you're actually looking out for? >> Anything. >> What's the level of shame which is accepted or not? Is there some shame? >> There's no such thing >> because there has to be some thin line, right? like not be >> see means saying oh you become creepy is a very different thing. >> Yeah. Would you be offended if somebody reaches out to you 20 times? >> No absolutely not. Why would I be offended by that? >> Like you're just like what the [ __ ] Like you'll block that person like irritate you because you didn't reply once or you didn't reply twice. >> But most people have no craft in reaching out to you, right? They don't establish the value that they provide to you. They send the same text. Like for example, a lot of people are guess if you see most people's DMs of uh uh thing, hi, hello, hello, hey, hey, hello. Like nobody's saying anything more. >> So that's the and how do you get over let's say a lot of people would reach out to a lot of people. That's saying we to establish value. Why would somebody give time attention? Most people underestimate that. >> This also goes back to the school years, right? We not taught to date. We're not taught to approach. We're not taught to sell ourselves. We're not taught to actually go out and go get people. >> Same thing. No, >> it's the same opportunities. >> The whole thing not like what is this whole like this thing that uh uh like Zakir comedian talks about Sakla? What is that? M >> is this not >> is there don't go out on >> I can't ask how I got to maintain my >> how can somebody break out of this >> by accepting that there's success outside of this >> because I'm trying to go to my life >> and thinking about >> but you'll see many people who come from business families are not naturally less see look at all the people who are misbehaving at the airport are usually from business families shame Shame because shame like I'm thinking shame or shamelessness. >> Yeah. >> I've always you probably got more shame in Bombay than where you are originally from. >> Oh yeah 100%. >> Like oh you can't behave this way. >> 100%. >> Yeah. So the only way it is just mentally you have to tell yourself that okay there's success on the other side. >> Mhm. >> And that's it. There's no other way for me to do it. >> Yeah. But you have to be crafty about it. You can't just like oh my message. >> Then you will get blocked. >> Yeah. For example, I say let's talk about dating scenario. What does this person want in their life? For example, let's say I'm reaching out to an investor. email pitch if you do not take any effort to find out what kind of stuff this person is likely to react to homework zero but everything else so I'll just do >> same thing in dating if you do not know what this person is expecting",https://www.youtube.com/watch?v=YIszsqhLGIs
youtube,"lot of people are guess if you see most people's DMs of uh uh thing, hi, hello, hello, hey, hey, hello. Like nobody's saying anything more. >> So that's the and how do you get over let's say a lot of people would reach out to a lot of people. That's saying we to establish value. Why would somebody give time attention? Most people underestimate that. >> This also goes back to the school years, right? We not taught to date. We're not taught to approach. We're not taught to sell ourselves. We're not taught to actually go out and go get people. >> Same thing. No, >> it's the same opportunities. >> The whole thing not like what is this whole like this thing that uh uh like Zakir comedian talks about Sakla? What is that? M >> is this not >> is there don't go out on >> I can't ask how I got to maintain my >> how can somebody break out of this >> by accepting that there's success outside of this >> because I'm trying to go to my life >> and thinking about >> but you'll see many people who come from business families are not naturally less see look at all the people who are misbehaving at the airport are usually from business families shame Shame because shame like I'm thinking shame or shamelessness. >> Yeah. >> I've always you probably got more shame in Bombay than where you are originally from. >> Oh yeah 100%. >> Like oh you can't behave this way. >> 100%. >> Yeah. So the only way it is just mentally you have to tell yourself that okay there's success on the other side. >> Mhm. >> And that's it. There's no other way for me to do it. >> Yeah. But you have to be crafty about it. You can't just like oh my message. >> Then you will get blocked. >> Yeah. For example, I say let's talk about dating scenario. What does this person want in their life? For example, let's say I'm reaching out to an investor. email pitch if you do not take any effort to find out what kind of stuff this person is likely to react to homework zero but everything else so I'll just do >> same thing in dating if you do not know what this person is expecting >> randomly you'll text >> so you will just say hello hi hello hello hi doesn't And you usually know what homework to do. There's no >> usually people who are interested to really get it right, they will do the homework. >> They'll figure out >> or find out. >> True. That's the way to think about it. >> Yeah. >> You said s let this be the last question. You said >> actually second last. Okay. You said sat long, alpha male if you want to put it. What's alpha male according to you? >> No, sorry. I don't think Sat Land is alpha model. I think I think I think uh someone like Zak does a fantastic job to actually make this into a humorous thing to this that it's almost a problematic slash uh insecure version of somebody to protect to pretend to be this person, right? and and and uh he's also kind of giving the other side to explain the nuance of what really it means internally to feel that way. But I think uh the whole thing around alpha whatever I I mean I I remember asking this question to Karan Johar once at one of the events I hosted is >> hey why are these movies doing big success and he's like kunal this has happened every decade this whole angry young man of different type has come back again and again in different forms it's existed from the beginning and I was like yeah that makes sense it's just that we feel this every now and then because it's almost It's a cycle that repeats >> right so I think uh anything that is different for a society's norm gets attention then again it becomes normal then we'll again have somebody who's loving and like this loving personality will again win so it'll be a cycle >> it's the same thing humans are very predictable that way fashions have exactly the same cycles >> these things of expecting personal ity is to be in cycle same thing continues. >> But what's your definition of alpha male? >> I don't think there is I I think to me these are uh uh uh more biology definitions uh versus uh a human definitions uh in in biology is very simple that somebody who has more success to get resources or mating success is",https://www.youtube.com/watch?v=YIszsqhLGIs
