source,text,url
twitter,Young folks in India are happy working from their native home &amp; saving cost of rent and getting home food. This is a fantastic short term benefit but the cost of this is very high. Learning being around smarter folks &amp; absorption by osmosis and overhearing has reduced to zero.,https://x.com/kunalb11/status/1432272720729829384
twitter,Elon musk may end up running 4+ 500 billion companies simultaneously at a relatively young age. What I want to really understand: how does he do it? How does he manage context switching? How does he design his Org? So many questions.,https://x.com/kunalb11/status/1359948968747126784
twitter,Debutants in cricket or business have the self confidence and talent that India has never seen before. This is the new India. Unstoppable.,https://x.com/kunalb11/status/1350683534919254020
twitter,Wealthy can give their kids almost everything except the struggle they faced to become who they are today.,https://x.com/kunalb11/status/1460879894317973506
twitter,India’s Population: 138 crore highest selling book in any year: max 1.5 lakh Most top books are motivational. Motivational books are like sports shoes. The joy of buying them makes you feel you’ve solved all your problems. But neither is really used by most except for status.,https://x.com/kunalb11/status/1474316512315985920
twitter,"We as Indians will have 2 choices after this storm is over. Give up hope and leave this nation after all the pain and suffering we went through. Convert all of this pain and suffering as potential energy to fix this nation forever. One choice is easy, other is worthy.",https://x.com/kunalb11/status/1388748460271104001
twitter,"Update: CRED members can now donate CRED coins towards buying oxygen concentrators for hospitals, healthcare orgs across India. With a goal of 1 billion litres, we’ve partnered with Milaap to ensure contributions reach hospitals in need.",https://x.com/kunalb11/status/1386640612246556675
twitter,"Don’t be a prisoner of your résumé. You wrote it to describe your past, not your future.",https://x.com/kunalb11/status/1284754052132122625
youtube,"You feel successful people don't gossip. >> Successful people actually are extraordinary at keeping secrets. They gossip to know information. You will never see a wealthy person who's terrible at keeping secrets. The moment second third generation who's not good at keeping secrets the wealth will go away. Were you good at keeping secrets from childhood? I was good at keeping people's trust. Tweet that you did. Fastest way to be called stupid in life is to have an opinion about power or politics. Why? You will notice that people who talk a lot about politics are usually powerless in life. What is your fear today? >> Fear of the poor. Nobody really wants to hang around with poor people. >> You've also said somewhere most Indians settle for average career. >> What's the truth about discipline and ambitious? Because a lot of people think they're ambitious. >> Most ambitious people will never say they're ambitious. They are just doing stuff, building stuff. They don't write all these tag words on their Twitter or Instagram or LinkedIn. There are many people who are famous for being cringe. You won't respect them. Do you have any insecurity? At times, even when you're doing everything right, something still goes wrong. Like you are all ready for a shoot, but you realize you forgot the mic. Or a teammate needs a document, but there's no one free to go drop it. These problems slow you down. That's why I use Porto. It helps me save time and effort by offering ondemand two-wheer and truck delivery services for all small and big things as per my needs. Their instant pickup and reliable deliveries not only reduce effort but also bring peace of mind. And it doesn't matter if you're a freelancer, a startup or an established company. Pis delivery and our today's guest Kunal Sha founder of cred also agrees with this way of thinking. He doesn't just spot problems before other people. He questions why they exist and how he can fix them. In today's episode, he talks about what is his biggest fear right now. What is he chasing? Fame, power, or money? Can someone build ambition like a skill? Why are we not acceptable of failure as a society? How can a person go from being mediocre to earning a place with an A+ crowd? And why is being a trustworthy person a huge part of success? Watch this episode till the end and tell me in the comments what did you learn from this conversation. Like my first big podcast I was just telling my team. >> Oh is that true? >> First I've done 50 60 episodes. >> Yours was the first and I did it >> and I remember the first line and we put it out in podcast as well. View podcast start. I'm nervous >> and you tell me. >> You remember it was incredible. I I do remember >> but like it's it's like kudos to you man. It is not uh it is absolutely elite athlete level achievement what you've done. Pretty cool man. >> Thank you. It means a lot. >> No no it is it is it is what is this like credit where it's due man. This is this is extraordinary work. >> Thank you so much. >> And and I can tell you it may look easy from outside. I know. Uh it has must have been a nightmare getting to this place. How old are you now? >> I'm 28. >> That's even more commendable, man. Good stuff. >> Thank you. Done. I'm actually happy. I was nervous. I'm a fan more than and more than the kunala. The person I'm fan of kunal sha the person who tweets born and brought up. I'm actually born uh in Ahmedabad. My mom's from here but I've always been here. So my I was like raised >> Bangalore. Bombay. >> No Bombay only. >> Okay. >> Bangalore is only less Indian. >> Yeah. It's just that I never got like good at it. >> Okay. >> Uh I can speak uh it's not that I can't speak Hindi but I know that I will struggle with words. >> You think in English? >> That's a good question. I don't know what language I think in >> but you read and consume everything in English. >> H no I I do consume in multiple languages. It's just that I don't know what language do I think in become a I think it's become a mixture now. Okay. >> Is it work? I don't know. I [ __ ] maybe I don't I don't have conversations with myself when I'm thinking. Okay. >> I'm usually just as a triggers then I go externally.",https://www.youtube.com/watch?v=YIszsqhLGIs
youtube,"person a huge part of success? Watch this episode till the end and tell me in the comments what did you learn from this conversation. Like my first big podcast I was just telling my team. >> Oh is that true? >> First I've done 50 60 episodes. >> Yours was the first and I did it >> and I remember the first line and we put it out in podcast as well. View podcast start. I'm nervous >> and you tell me. >> You remember it was incredible. I I do remember >> but like it's it's like kudos to you man. It is not uh it is absolutely elite athlete level achievement what you've done. Pretty cool man. >> Thank you. It means a lot. >> No no it is it is it is what is this like credit where it's due man. This is this is extraordinary work. >> Thank you so much. >> And and I can tell you it may look easy from outside. I know. Uh it has must have been a nightmare getting to this place. How old are you now? >> I'm 28. >> That's even more commendable, man. Good stuff. >> Thank you. Done. I'm actually happy. I was nervous. I'm a fan more than and more than the kunala. The person I'm fan of kunal sha the person who tweets born and brought up. I'm actually born uh in Ahmedabad. My mom's from here but I've always been here. So my I was like raised >> Bangalore. Bombay. >> No Bombay only. >> Okay. >> Bangalore is only less Indian. >> Yeah. It's just that I never got like good at it. >> Okay. >> Uh I can speak uh it's not that I can't speak Hindi but I know that I will struggle with words. >> You think in English? >> That's a good question. I don't know what language I think in >> but you read and consume everything in English. >> H no I I do consume in multiple languages. It's just that I don't know what language do I think in become a I think it's become a mixture now. Okay. >> Is it work? I don't know. I [ __ ] maybe I don't I don't have conversations with myself when I'm thinking. Okay. >> I'm usually just as a triggers then I go externally. That's a good question. Wow. Maybe I've stopped. Wow. I'm trying to think on which language I'm thinking. I'm not able to. I think it's reached into some kind of a like languageless thinking approach now. It's just more of like triggers and >> I think it's multiple languages. >> Okay. >> Multiple things together. >> Yeah. It's like a full ADHD brain. So it's a little >> Okay. Try to break it down for me. For example, let's say behavior, human behavior, all of these things, right? So you said you get triggers and it triggers something in you like okay what goes on so I think uh step by step actually opinion comes after thinking about for probably months and years. Uh I don't think observe and I get an opinion. I usually I'm observing observing observing observing and pattern and then I see the pattern being a larger pattern about something and then I try to capture it in one sentence so that I can register it as a pattern. >> Right? So example um I I observed historically shameful method is to convert that into pride. >> Okay. Cigarettes used to be back in the day something as a shameful behavior. So they showed mal broman this that pride all of that and then converted that into normalized behavior. Right? If you see uh the the the recent times where we now accepted homosexuality as uh a thing, it went through a moment of first being proud about it, right? And like if you see the the pride parades or whatever are are a method. So you'll notice that anything about human beings that was historically shameful or treated shamefully converted into pride and then became normal. >> So it's an interesting thing that how is this pattern repeats again and again and again. So I always observe these things and say yeah and then I see if it's true. So what I do is then I try to find more examples and now with chat GP I could actually get 10 examples of it and then you're like oh wow like this is again and again and again repeating so what I try to do is find observations see if it's widespread and then capture the essence key >> see because you're talking about observation and shame M >> one thing which is very shameful",https://www.youtube.com/watch?v=YIszsqhLGIs
youtube,"That's a good question. Wow. Maybe I've stopped. Wow. I'm trying to think on which language I'm thinking. I'm not able to. I think it's reached into some kind of a like languageless thinking approach now. It's just more of like triggers and >> I think it's multiple languages. >> Okay. >> Multiple things together. >> Yeah. It's like a full ADHD brain. So it's a little >> Okay. Try to break it down for me. For example, let's say behavior, human behavior, all of these things, right? So you said you get triggers and it triggers something in you like okay what goes on so I think uh step by step actually opinion comes after thinking about for probably months and years. Uh I don't think observe and I get an opinion. I usually I'm observing observing observing observing and pattern and then I see the pattern being a larger pattern about something and then I try to capture it in one sentence so that I can register it as a pattern. >> Right? So example um I I observed historically shameful method is to convert that into pride. >> Okay. Cigarettes used to be back in the day something as a shameful behavior. So they showed mal broman this that pride all of that and then converted that into normalized behavior. Right? If you see uh the the the recent times where we now accepted homosexuality as uh a thing, it went through a moment of first being proud about it, right? And like if you see the the pride parades or whatever are are a method. So you'll notice that anything about human beings that was historically shameful or treated shamefully converted into pride and then became normal. >> So it's an interesting thing that how is this pattern repeats again and again and again. So I always observe these things and say yeah and then I see if it's true. So what I do is then I try to find more examples and now with chat GP I could actually get 10 examples of it and then you're like oh wow like this is again and again and again repeating so what I try to do is find observations see if it's widespread and then capture the essence key >> see because you're talking about observation and shame M >> one thing which is very shameful today is failure. >> When you fail in public >> okay >> and that probably is something that we need to because I was reading bunch of your tweets >> that is something that we need to get over in order to try more or maybe succeed as a society in a better way. >> Right? >> How do you think that will happen first? Actually why do you think failure is seen as a shameful event in our country? See the thing is the uh first of all let's just understand how we are raised. Uh there is this perpetual fear. Everybody is living in some version of fear. Society fear exam fear and and we also raise kids through fear. Okay, if you do not do this, this will happen. Nobody will respect you. All of that stuff, right? So when your default state is fear, failure is the dreaded, right? Uh and that causes the society to feel safe in some ways, right? But it makes it is very common in the emotional societies. For example, India was completely apathy or complete panic. >> Right? You will notice one more thing that Indians when they rate an app they will do one star or five star two three four star right because that's an emotional response. YouTube used to be have earlier different ratings if you remember then it moved to up thumbs up and thumbs down. Yeah, >> right. Cuz that's how emotional reactions are, right? I and that's like, oh, I'm a fan and then if they don't do well, oh, we'll hate, >> right? And and therefore I I often say that we like to create gods out of people and then do vis of them, right? And that's how we feel okay about things, right? >> So I think what happens is failure part, right? comes from what do we celebrate? Right? Uh now risky behavior historically resulted in you being left out in the society and the society had no way to bring you up or whatever and you would be like treated as somebody who has bad judgment. risk simple simple for example let's say our movement as a society from saving account to fixed deposits to investing in mutual funds to investing in stocks is a journey >> right >> and you will see that different communities in different societies",https://www.youtube.com/watch?v=YIszsqhLGIs
youtube,"today is failure. >> When you fail in public >> okay >> and that probably is something that we need to because I was reading bunch of your tweets >> that is something that we need to get over in order to try more or maybe succeed as a society in a better way. >> Right? >> How do you think that will happen first? Actually why do you think failure is seen as a shameful event in our country? See the thing is the uh first of all let's just understand how we are raised. Uh there is this perpetual fear. Everybody is living in some version of fear. Society fear exam fear and and we also raise kids through fear. Okay, if you do not do this, this will happen. Nobody will respect you. All of that stuff, right? So when your default state is fear, failure is the dreaded, right? Uh and that causes the society to feel safe in some ways, right? But it makes it is very common in the emotional societies. For example, India was completely apathy or complete panic. >> Right? You will notice one more thing that Indians when they rate an app they will do one star or five star two three four star right because that's an emotional response. YouTube used to be have earlier different ratings if you remember then it moved to up thumbs up and thumbs down. Yeah, >> right. Cuz that's how emotional reactions are, right? I and that's like, oh, I'm a fan and then if they don't do well, oh, we'll hate, >> right? And and therefore I I often say that we like to create gods out of people and then do vis of them, right? And that's how we feel okay about things, right? >> So I think what happens is failure part, right? comes from what do we celebrate? Right? Uh now risky behavior historically resulted in you being left out in the society and the society had no way to bring you up or whatever and you would be like treated as somebody who has bad judgment. risk simple simple for example let's say our movement as a society from saving account to fixed deposits to investing in mutual funds to investing in stocks is a journey >> right >> and you will see that different communities in different societies for example business families had a very different relationship with money >> because risk was innate to you notice that they were the earliest to adopt the riskier part of life >> true >> right >> but when you see younger people they are now adopting riskier faster because their household is safe. For example, you did not have to think about fair. >> So your failure ability or your risk appetite changed materially. the next generation will be significantly much more attuned to failure because the failure doesn't mean like I have had stages of life where I did not have money to eat right and you are literally I would go I remember like buying chana on credit chana singh on credit >> right so that has a very different tolerance sometimes losing everything also makes you very good at failure Right. If you notice somebody that because it's so close to zero. Yeah. >> So you will see that people who have less money are doing more riskier behavior >> right like for example people who are getting caught in investment scams this that they're like okay small money. M >> so I think failure comes in a mixed thing but culturally we are a collectivist society collective society simp >> right when we were you would remember that your grandparents would tell you that and we used to wear the same shirt right but now imagine trying to tell three cousins you're going to wear the same clothes it's not okay they have become individuals now right so as we move from let's say a non-indiv individualistic society to individualistic we will get to more failure understanding choices and so on and so forth but there's another thing that is happening which is preventing failure again >> is people fearing their social media followers >> right that let's say you are a young person and you have like managed to get 2,000 followers in your head you're already a celebrity Raj you will remember when you had 50,000 followers and you would get 40 likes, your reaction would be the same as today at millions of followers, right? The the threshold has changed. >> Yeah. >> Right. But unfortunately, we get shaped by our audience, which is a problematic loop. Right? For example, >> when I tweet, I am not thinking about likes because if I",https://www.youtube.com/watch?v=YIszsqhLGIs
youtube,"for example business families had a very different relationship with money >> because risk was innate to you notice that they were the earliest to adopt the riskier part of life >> true >> right >> but when you see younger people they are now adopting riskier faster because their household is safe. For example, you did not have to think about fair. >> So your failure ability or your risk appetite changed materially. the next generation will be significantly much more attuned to failure because the failure doesn't mean like I have had stages of life where I did not have money to eat right and you are literally I would go I remember like buying chana on credit chana singh on credit >> right so that has a very different tolerance sometimes losing everything also makes you very good at failure Right. If you notice somebody that because it's so close to zero. Yeah. >> So you will see that people who have less money are doing more riskier behavior >> right like for example people who are getting caught in investment scams this that they're like okay small money. M >> so I think failure comes in a mixed thing but culturally we are a collectivist society collective society simp >> right when we were you would remember that your grandparents would tell you that and we used to wear the same shirt right but now imagine trying to tell three cousins you're going to wear the same clothes it's not okay they have become individuals now right so as we move from let's say a non-indiv individualistic society to individualistic we will get to more failure understanding choices and so on and so forth but there's another thing that is happening which is preventing failure again >> is people fearing their social media followers >> right that let's say you are a young person and you have like managed to get 2,000 followers in your head you're already a celebrity Raj you will remember when you had 50,000 followers and you would get 40 likes, your reaction would be the same as today at millions of followers, right? The the threshold has changed. >> Yeah. >> Right. But unfortunately, we get shaped by our audience, which is a problematic loop. Right? For example, >> when I tweet, I am not thinking about likes because if I was thinking about likes, I know exactly how to get them. I can say emotions capture you'll get consistently but I write for myself >> right so you will see from a 50 likes to a 50,000 likes coming together it's not consistent because I don't care about the audience but what you'll notice is that eventually everybody starts caring and if you're a young person you start thinking about the 2,000 followers and what will they like what will they judge me for what are they going to think about me? And then your personality starts getting shaped through the views of these 2,000 people that you would otherwise not care about. So that's becoming a problematic loop for >> it's a very big trap because everybody is like trying so hard to differentiate now right when I was growing up social media pre- internet when I was in college in my first year second year internet has not become big yet like a group of 10 you could be different in that right jeans right difference. >> But now when you are being trying to be different with 2,000 followers, you have to find different way to be aesthetic. You have to find a different way to be cool. Travel to unique places that nobody has been to. Capture the same thing differently, right? Go to some music festival, but take a very different clip of that music festival so that you feel cool. or you are closer to the stage or not closer to the stage to to signal that okay I'm in the more important place or not right uh uh capturing unique food >> so that you feel that I try different things and so on and so forth so this deep need to differentiate is frying people's brain >> right >> right like for example you are going and getting Vijay Malia on the podcast is your breaking out of differentiation right it's a it's a thing that is needed Because how would people find that? Okay. What is the thing difference that you bring to the table? >> Why do you think it's a bad thing? >> It's not a bad thing. It it's just very taxing. It's not bad thing. I'm just saying first of all, one thing we should avoid Raj is that categorizing things in good and bad. >> It's",https://www.youtube.com/watch?v=YIszsqhLGIs
